id,product_id,customer_id,order_id,rating,review_title,review_body,reviewed_at
1,1,1,1,5,Perfect morning coffee,Smooth and well-balanced. My daily go-to drink.,2023-03-16 08:00:00
2,3,5,5,4,Great vanilla latte,Nice flavor but a bit too sweet for my taste. Would order again with less syrup.,2023-07-02 10:00:00
3,2,20,10,5,Best cold brew in town,Incredibly smooth. No bitterness at all. Love the 24-hour extraction process.,2024-01-06 14:00:00
4,5,12,8,3,Decent muffin,Good size but could use more blueberries. A bit dry compared to other bakeries.,2023-09-11 09:00:00
5,4,35,15,5,Caramel perfection,The caramel drizzle makes this drink. Absolutely delicious every time.,2024-03-19 11:00:00
6,6,50,22,4,Warming chai,Great spice blend. The chai concentrate is clearly high quality.,2024-06-02 15:00:00
7,8,100,30,5,Flaky and chocolatey,Best chocolate croissant I have had outside of Paris. Perfectly flaky.,2024-09-13 08:00:00
